{
  "contractVersion": "1.0",
  "reviewId": "review-b5c258ae34fb7ed0e668",
  "snapshotSha256": "b5c258ae34fb7ed0e668db89dd0e4b9a3dd702787cf499e2ac748f3c69a3d774",
  "mode": "full",
  "status": "complete",
  "verdict": "recommend-approval",
  "reviewers": [
    {
      "role": "code-quality",
      "status": "completed",
      "adapter": {
        "adapterId": "claude-code-v1",
        "providerId": "anthropic-claude-code",
        "modelId": "sonnet"
      },
      "invocationId": "invocation-71bbdf0a-ce61-4b6d-83f5-c44449d53702",
      "contextId": "f23615de-81df-4361-89d0-be3c805c4d59"
    },
    {
      "role": "security",
      "status": "completed",
      "adapter": {
        "adapterId": "claude-code-v1",
        "providerId": "anthropic-claude-code",
        "modelId": "sonnet"
      },
      "invocationId": "invocation-c49bb7de-048c-44f5-8f3d-d65d9878193f",
      "contextId": "19ab92fe-3def-4f1c-ab75-ec0520e76d0e"
    },
    {
      "role": "performance",
      "status": "completed",
      "adapter": {
        "adapterId": "claude-code-v1",
        "providerId": "anthropic-claude-code",
        "modelId": "sonnet"
      },
      "invocationId": "invocation-2d6f46bc-ec44-487d-8b92-c61fdf78590e",
      "contextId": "161e18d3-5c87-45f8-8ccf-2dd97569cc81"
    }
  ],
  "findings": [],
  "unverifiableFindings": [],
  "coverage": {
    "includedPaths": [
      "src/werkzeug/security.py",
      "tests/test_security.py"
    ],
    "excludedPaths": [
      "CHANGES.rst"
    ],
    "skippedChecks": [
      "excluded content was omitted from reviewer input.",
      "Sandbox verification was not requested."
    ]
  },
  "limitations": [
    "code-quality: CLI token usage is unavailable before invocation; a large fixed protocol reserve is used.",
    "code-quality: Model identity is the configured CLI selection; exact served model identity is unverified.",
    "code-quality: Context capacity and protocol reserve are caller-configured assumptions.",
    "model usage reporting is unavailable",
    "security: CLI token usage is unavailable before invocation; a large fixed protocol reserve is used.",
    "security: Model identity is the configured CLI selection; exact served model identity is unverified.",
    "security: Context capacity and protocol reserve are caller-configured assumptions.",
    "performance: CLI token usage is unavailable before invocation; a large fixed protocol reserve is used.",
    "performance: Model identity is the configured CLI selection; exact served model identity is unverified.",
    "performance: Context capacity and protocol reserve are caller-configured assumptions."
  ],
  "preflight": {
    "contractVersion": "1.0",
    "kind": "preflight",
    "status": "ready",
    "reviewId": "review-b5c258ae34fb7ed0e668",
    "snapshotSha256": "b5c258ae34fb7ed0e668db89dd0e4b9a3dd702787cf499e2ac748f3c69a3d774",
    "policyVersion": "ec28adec30457dc29ab24434bbe2dd394b04cbde0fbd4be2d37acf6d0ebc758d",
    "mode": "full",
    "promptVersions": [
      {
        "role": "code-quality",
        "version": "27bce1d1c541c20c1d428ac3a4bd26b0431030779fb71aa43fa5e08a6f32106a"
      },
      {
        "role": "security",
        "version": "b0a7cbe7d719df231500d09537618cd4b0ca1bfd3ef6ee4601ee4c70ecb4ad14"
      },
      {
        "role": "performance",
        "version": "420a63cca0f8281775e8c0d000ed60a2048656da3f6eefe49bf3a80ca8e154a2"
      }
    ],
    "scopeCounts": {
      "included": 2,
      "excluded": 1,
      "binary": 0,
      "generated": 0,
      "oversized": 0
    },
    "budgets": {
      "maxFiles": 50,
      "maxChangedLines": 6000,
      "maxLinesPerFile": 2000,
      "maxBytesPerFile": 1048576,
      "maxInputTokensPerReviewer": 100000,
      "maxOutputTokensPerReviewer": 2000,
      "maxModelCalls": 3,
      "timeoutSeconds": 120
    },
    "harness": {
      "adapterId": "static-review-harness",
      "adapterVersion": "1.0",
      "controls": {
        "readOnlyInput": "enforced",
        "noAgentWrite": "enforced",
        "noAgentExecution": "enforced",
        "noAgentNetwork": "enforced",
        "freshContextPerReviewer": "enforced",
        "crossSessionMemoryDisabled": "enforced"
      }
    },
    "reviewers": [
      {
        "role": "code-quality",
        "adapterId": "claude-code-v1",
        "providerId": "anthropic-claude-code",
        "modelId": "sonnet",
        "dataHandling": "hosted",
        "adapterVersion": "1.0",
        "inputTokenUpperBound": 81767,
        "controls": {
          "freshContextPerReviewer": "enforced",
          "crossSessionMemoryDisabled": "enforced",
          "structuredOutput": "enforced",
          "usageReporting": "unsupported"
        }
      },
      {
        "role": "security",
        "adapterId": "claude-code-v1",
        "providerId": "anthropic-claude-code",
        "modelId": "sonnet",
        "dataHandling": "hosted",
        "adapterVersion": "1.0",
        "inputTokenUpperBound": 82949,
        "controls": {
          "freshContextPerReviewer": "enforced",
          "crossSessionMemoryDisabled": "enforced",
          "structuredOutput": "enforced",
          "usageReporting": "unsupported"
        }
      },
      {
        "role": "performance",
        "adapterId": "claude-code-v1",
        "providerId": "anthropic-claude-code",
        "modelId": "sonnet",
        "dataHandling": "hosted",
        "adapterVersion": "1.0",
        "inputTokenUpperBound": 82412,
        "controls": {
          "freshContextPerReviewer": "enforced",
          "crossSessionMemoryDisabled": "enforced",
          "structuredOutput": "enforced",
          "usageReporting": "unsupported"
        }
      }
    ],
    "hostedSourceDisclosure": true,
    "limitations": [
      "code-quality: CLI token usage is unavailable before invocation; a large fixed protocol reserve is used.",
      "code-quality: Model identity is the configured CLI selection; exact served model identity is unverified.",
      "code-quality: Context capacity and protocol reserve are caller-configured assumptions.",
      "model usage reporting is unavailable",
      "security: CLI token usage is unavailable before invocation; a large fixed protocol reserve is used.",
      "security: Model identity is the configured CLI selection; exact served model identity is unverified.",
      "security: Context capacity and protocol reserve are caller-configured assumptions.",
      "performance: CLI token usage is unavailable before invocation; a large fixed protocol reserve is used.",
      "performance: Model identity is the configured CLI selection; exact served model identity is unverified.",
      "performance: Context capacity and protocol reserve are caller-configured assumptions."
    ],
    "sandbox": {
      "status": "not-requested"
    },
    "audit": {
      "enabled": false,
      "metadataOnly": true,
      "retentionDays": 0
    }
  },
  "sandbox": {
    "status": "not-requested"
  }
}
