{
  "contractVersion": "1.0",
  "reviewId": "review-231e7fab1462e474f920",
  "snapshotSha256": "231e7fab1462e474f9209d0c52c34086912cfe1cc985d5d288d0c27a0cc6f4f4",
  "mode": "full",
  "status": "complete",
  "verdict": "recommend-approval",
  "reviewers": [
    {
      "role": "code-quality",
      "status": "completed",
      "adapter": {
        "adapterId": "claude-code-v1",
        "providerId": "anthropic-claude-code",
        "modelId": "sonnet"
      },
      "invocationId": "invocation-62da8361-e117-46fc-92df-706863d05170",
      "contextId": "b196c7e0-ff5b-42fd-9be3-f3238af5cb8a"
    },
    {
      "role": "security",
      "status": "completed",
      "adapter": {
        "adapterId": "claude-code-v1",
        "providerId": "anthropic-claude-code",
        "modelId": "sonnet"
      },
      "invocationId": "invocation-b38455f2-b216-40fc-a0b6-db525d0186f0",
      "contextId": "aad54f3d-fe42-4b2f-98fc-76ffec5e1ded"
    },
    {
      "role": "performance",
      "status": "completed",
      "adapter": {
        "adapterId": "claude-code-v1",
        "providerId": "anthropic-claude-code",
        "modelId": "sonnet"
      },
      "invocationId": "invocation-ce07473a-84ba-4316-83dc-5bcf9f646b2f",
      "contextId": "7ccd7823-db79-4c50-be50-ac35e175bdc2"
    }
  ],
  "findings": [],
  "unverifiableFindings": [],
  "coverage": {
    "includedPaths": [
      "README.md"
    ],
    "excludedPaths": [],
    "skippedChecks": [
      "Sandbox verification was not requested."
    ]
  },
  "limitations": [
    "code-quality: CLI token usage is unavailable before invocation; a large fixed protocol reserve is used.",
    "code-quality: Model identity is the configured CLI selection; exact served model identity is unverified.",
    "code-quality: Context capacity and protocol reserve are caller-configured assumptions.",
    "model usage reporting is unavailable",
    "security: CLI token usage is unavailable before invocation; a large fixed protocol reserve is used.",
    "security: Model identity is the configured CLI selection; exact served model identity is unverified.",
    "security: Context capacity and protocol reserve are caller-configured assumptions.",
    "performance: CLI token usage is unavailable before invocation; a large fixed protocol reserve is used.",
    "performance: Model identity is the configured CLI selection; exact served model identity is unverified.",
    "performance: Context capacity and protocol reserve are caller-configured assumptions."
  ],
  "preflight": {
    "contractVersion": "1.0",
    "kind": "preflight",
    "status": "ready",
    "reviewId": "review-231e7fab1462e474f920",
    "snapshotSha256": "231e7fab1462e474f9209d0c52c34086912cfe1cc985d5d288d0c27a0cc6f4f4",
    "policyVersion": "de6a22a011f99b62672349d67b0fff1ae737df5c6aac622d71d08d8c3c31acf7",
    "mode": "full",
    "promptVersions": [
      {
        "role": "code-quality",
        "version": "27bce1d1c541c20c1d428ac3a4bd26b0431030779fb71aa43fa5e08a6f32106a"
      },
      {
        "role": "security",
        "version": "b0a7cbe7d719df231500d09537618cd4b0ca1bfd3ef6ee4601ee4c70ecb4ad14"
      },
      {
        "role": "performance",
        "version": "420a63cca0f8281775e8c0d000ed60a2048656da3f6eefe49bf3a80ca8e154a2"
      }
    ],
    "scopeCounts": {
      "included": 1,
      "excluded": 0,
      "binary": 0,
      "generated": 0,
      "oversized": 0
    },
    "budgets": {
      "maxFiles": 50,
      "maxChangedLines": 6000,
      "maxLinesPerFile": 2000,
      "maxBytesPerFile": 1048576,
      "maxInputTokensPerReviewer": 100000,
      "maxOutputTokensPerReviewer": 2000,
      "maxModelCalls": 3,
      "timeoutSeconds": 120
    },
    "harness": {
      "adapterId": "static-review-harness",
      "adapterVersion": "1.0",
      "controls": {
        "readOnlyInput": "enforced",
        "noAgentWrite": "enforced",
        "noAgentExecution": "enforced",
        "noAgentNetwork": "enforced",
        "freshContextPerReviewer": "enforced",
        "crossSessionMemoryDisabled": "enforced"
      }
    },
    "reviewers": [
      {
        "role": "code-quality",
        "adapterId": "claude-code-v1",
        "providerId": "anthropic-claude-code",
        "modelId": "sonnet",
        "dataHandling": "hosted",
        "adapterVersion": "1.0",
        "inputTokenUpperBound": 76356,
        "controls": {
          "freshContextPerReviewer": "enforced",
          "crossSessionMemoryDisabled": "enforced",
          "structuredOutput": "enforced",
          "usageReporting": "unsupported"
        }
      },
      {
        "role": "security",
        "adapterId": "claude-code-v1",
        "providerId": "anthropic-claude-code",
        "modelId": "sonnet",
        "dataHandling": "hosted",
        "adapterVersion": "1.0",
        "inputTokenUpperBound": 77538,
        "controls": {
          "freshContextPerReviewer": "enforced",
          "crossSessionMemoryDisabled": "enforced",
          "structuredOutput": "enforced",
          "usageReporting": "unsupported"
        }
      },
      {
        "role": "performance",
        "adapterId": "claude-code-v1",
        "providerId": "anthropic-claude-code",
        "modelId": "sonnet",
        "dataHandling": "hosted",
        "adapterVersion": "1.0",
        "inputTokenUpperBound": 77001,
        "controls": {
          "freshContextPerReviewer": "enforced",
          "crossSessionMemoryDisabled": "enforced",
          "structuredOutput": "enforced",
          "usageReporting": "unsupported"
        }
      }
    ],
    "hostedSourceDisclosure": true,
    "limitations": [
      "code-quality: CLI token usage is unavailable before invocation; a large fixed protocol reserve is used.",
      "code-quality: Model identity is the configured CLI selection; exact served model identity is unverified.",
      "code-quality: Context capacity and protocol reserve are caller-configured assumptions.",
      "model usage reporting is unavailable",
      "security: CLI token usage is unavailable before invocation; a large fixed protocol reserve is used.",
      "security: Model identity is the configured CLI selection; exact served model identity is unverified.",
      "security: Context capacity and protocol reserve are caller-configured assumptions.",
      "performance: CLI token usage is unavailable before invocation; a large fixed protocol reserve is used.",
      "performance: Model identity is the configured CLI selection; exact served model identity is unverified.",
      "performance: Context capacity and protocol reserve are caller-configured assumptions."
    ],
    "sandbox": {
      "status": "not-requested"
    },
    "audit": {
      "enabled": false,
      "metadataOnly": true,
      "retentionDays": 0
    }
  },
  "sandbox": {
    "status": "not-requested"
  }
}
