{
  "contractVersion": "1.0",
  "reviewId": "review-ddeb5c1575f5202aaa87",
  "snapshotSha256": "ddeb5c1575f5202aaa877585d4c92fbe6323f11f5c79026cb0014e868ec47625",
  "mode": "full",
  "status": "complete",
  "verdict": "recommend-approval",
  "reviewers": [
    {
      "role": "code-quality",
      "status": "completed",
      "adapter": {
        "adapterId": "claude-code-v1",
        "providerId": "anthropic-claude-code",
        "modelId": "sonnet"
      },
      "invocationId": "invocation-642c748e-ab23-46a3-b74a-e6610f3b3a51",
      "contextId": "143dcce0-339b-40f8-ae05-4dff107cfec7"
    },
    {
      "role": "security",
      "status": "completed",
      "adapter": {
        "adapterId": "claude-code-v1",
        "providerId": "anthropic-claude-code",
        "modelId": "sonnet"
      },
      "invocationId": "invocation-eeb4a348-cd52-4b5b-8f99-f6694e4c2c30",
      "contextId": "bda6172a-7e5a-41b0-986a-7ef44ecac96d"
    },
    {
      "role": "performance",
      "status": "completed",
      "adapter": {
        "adapterId": "claude-code-v1",
        "providerId": "anthropic-claude-code",
        "modelId": "sonnet"
      },
      "invocationId": "invocation-70b0218d-eb3f-4541-9428-7a44908d59dc",
      "contextId": "18fe36f6-3a81-4e35-90c7-aabdfeeeccd7"
    }
  ],
  "findings": [],
  "unverifiableFindings": [],
  "coverage": {
    "includedPaths": [
      "numpy/_core/src/multiarray/stringdtype/static_string.c",
      "numpy/_core/src/multiarray/stringdtype/static_string.h"
    ],
    "excludedPaths": [
      "doc/release/upcoming_changes/31662.improvement.rst",
      "numpy/_core/tests/test_stringdtype.py"
    ],
    "skippedChecks": [
      "excluded content was omitted from reviewer input.",
      "Sandbox verification was not requested."
    ]
  },
  "limitations": [
    "code-quality: CLI token usage is unavailable before invocation; a large fixed protocol reserve is used.",
    "code-quality: Model identity is the configured CLI selection; exact served model identity is unverified.",
    "code-quality: Context capacity and protocol reserve are caller-configured assumptions.",
    "model usage reporting is unavailable",
    "security: CLI token usage is unavailable before invocation; a large fixed protocol reserve is used.",
    "security: Model identity is the configured CLI selection; exact served model identity is unverified.",
    "security: Context capacity and protocol reserve are caller-configured assumptions.",
    "performance: CLI token usage is unavailable before invocation; a large fixed protocol reserve is used.",
    "performance: Model identity is the configured CLI selection; exact served model identity is unverified.",
    "performance: Context capacity and protocol reserve are caller-configured assumptions."
  ],
  "preflight": {
    "contractVersion": "1.0",
    "kind": "preflight",
    "status": "ready",
    "reviewId": "review-ddeb5c1575f5202aaa87",
    "snapshotSha256": "ddeb5c1575f5202aaa877585d4c92fbe6323f11f5c79026cb0014e868ec47625",
    "policyVersion": "dcfbfab006a21556c7753a82e2c656f2721cd5ce97ac9ad2cf2132395004ee0c",
    "mode": "full",
    "promptVersions": [
      {
        "role": "code-quality",
        "version": "27bce1d1c541c20c1d428ac3a4bd26b0431030779fb71aa43fa5e08a6f32106a"
      },
      {
        "role": "security",
        "version": "b0a7cbe7d719df231500d09537618cd4b0ca1bfd3ef6ee4601ee4c70ecb4ad14"
      },
      {
        "role": "performance",
        "version": "420a63cca0f8281775e8c0d000ed60a2048656da3f6eefe49bf3a80ca8e154a2"
      }
    ],
    "scopeCounts": {
      "included": 2,
      "excluded": 2,
      "binary": 0,
      "generated": 0,
      "oversized": 0
    },
    "budgets": {
      "maxFiles": 50,
      "maxChangedLines": 6000,
      "maxLinesPerFile": 2000,
      "maxBytesPerFile": 1048576,
      "maxInputTokensPerReviewer": 150000,
      "maxOutputTokensPerReviewer": 2000,
      "maxModelCalls": 3,
      "timeoutSeconds": 120
    },
    "harness": {
      "adapterId": "static-review-harness",
      "adapterVersion": "1.0",
      "controls": {
        "readOnlyInput": "enforced",
        "noAgentWrite": "enforced",
        "noAgentExecution": "enforced",
        "noAgentNetwork": "enforced",
        "freshContextPerReviewer": "enforced",
        "crossSessionMemoryDisabled": "enforced"
      }
    },
    "reviewers": [
      {
        "role": "code-quality",
        "adapterId": "claude-code-v1",
        "providerId": "anthropic-claude-code",
        "modelId": "sonnet",
        "dataHandling": "hosted",
        "adapterVersion": "1.0",
        "inputTokenUpperBound": 109749,
        "controls": {
          "freshContextPerReviewer": "enforced",
          "crossSessionMemoryDisabled": "enforced",
          "structuredOutput": "enforced",
          "usageReporting": "unsupported"
        }
      },
      {
        "role": "security",
        "adapterId": "claude-code-v1",
        "providerId": "anthropic-claude-code",
        "modelId": "sonnet",
        "dataHandling": "hosted",
        "adapterVersion": "1.0",
        "inputTokenUpperBound": 110931,
        "controls": {
          "freshContextPerReviewer": "enforced",
          "crossSessionMemoryDisabled": "enforced",
          "structuredOutput": "enforced",
          "usageReporting": "unsupported"
        }
      },
      {
        "role": "performance",
        "adapterId": "claude-code-v1",
        "providerId": "anthropic-claude-code",
        "modelId": "sonnet",
        "dataHandling": "hosted",
        "adapterVersion": "1.0",
        "inputTokenUpperBound": 110394,
        "controls": {
          "freshContextPerReviewer": "enforced",
          "crossSessionMemoryDisabled": "enforced",
          "structuredOutput": "enforced",
          "usageReporting": "unsupported"
        }
      }
    ],
    "hostedSourceDisclosure": true,
    "limitations": [
      "code-quality: CLI token usage is unavailable before invocation; a large fixed protocol reserve is used.",
      "code-quality: Model identity is the configured CLI selection; exact served model identity is unverified.",
      "code-quality: Context capacity and protocol reserve are caller-configured assumptions.",
      "model usage reporting is unavailable",
      "security: CLI token usage is unavailable before invocation; a large fixed protocol reserve is used.",
      "security: Model identity is the configured CLI selection; exact served model identity is unverified.",
      "security: Context capacity and protocol reserve are caller-configured assumptions.",
      "performance: CLI token usage is unavailable before invocation; a large fixed protocol reserve is used.",
      "performance: Model identity is the configured CLI selection; exact served model identity is unverified.",
      "performance: Context capacity and protocol reserve are caller-configured assumptions."
    ],
    "sandbox": {
      "status": "not-requested"
    },
    "audit": {
      "enabled": false,
      "metadataOnly": true,
      "retentionDays": 0
    }
  },
  "sandbox": {
    "status": "not-requested"
  }
}
