{
  "contractVersion": "1.0",
  "reviewId": "review-915697b72042830362b2",
  "snapshotSha256": "915697b72042830362b23a1b14603c19184924773d4c001dc3c1eb4a0e87706a",
  "mode": "full",
  "status": "complete",
  "verdict": "recommend-approval",
  "reviewers": [
    {
      "role": "code-quality",
      "status": "completed",
      "adapter": {
        "adapterId": "claude-code-v1",
        "providerId": "anthropic-claude-code",
        "modelId": "sonnet"
      },
      "invocationId": "invocation-ae8981f6-34fe-4ba2-9e13-8037f2a1b36c",
      "contextId": "eef15cc6-2879-4af4-88d9-35e55031042e"
    },
    {
      "role": "security",
      "status": "completed",
      "adapter": {
        "adapterId": "claude-code-v1",
        "providerId": "anthropic-claude-code",
        "modelId": "sonnet"
      },
      "invocationId": "invocation-bb473f39-f751-4df0-a09e-4081e15d2788",
      "contextId": "35f3a862-366b-400f-80cf-296cb28e7300"
    },
    {
      "role": "performance",
      "status": "completed",
      "adapter": {
        "adapterId": "claude-code-v1",
        "providerId": "anthropic-claude-code",
        "modelId": "sonnet"
      },
      "invocationId": "invocation-fa49f2d6-a77f-47a6-bd94-2967899f0772",
      "contextId": "59e1b8ec-d641-4e79-b4fb-3b86e768e341"
    }
  ],
  "findings": [
    {
      "id": "finding-1",
      "category": "correctness",
      "severity": "Optional",
      "title": "Length-modulo padding detection breaks padded auth values containing newline or CR",
      "impact": "The change picks the base64 decoder from len(field)%4. Go's base64 decoders skip \\r and \\n, but those characters still count toward the length. A padded auth value with a trailing or embedded newline, for example from a hand-edited or wrapped config, then has a length that is not a multiple of 4. It is sent to RawStdEncoding, which rejects the '=' padding. Such an entry used to decode, so it now fails with an error and the credentials are dropped. This is a compatibility regression that causes an authentication failure, not a security hole.",
      "evidence": {
        "path": "pkg/credentialprovider/config.go",
        "startLine": 288,
        "endLine": 297
      },
      "recommendation": "Strip whitespace first (strings.TrimSpace, or remove \\r and \\n) before measuring length. Alternatively, choose the decoder with strings.HasSuffix(trimmed, \"=\"), or try StdEncoding and fall back to RawStdEncoding on error. Add a test for a padded value with a trailing newline.",
      "sourceFindings": [
        {
          "reviewer": "security",
          "findingId": "f1",
          "severity": "Optional",
          "confidence": 0.5
        }
      ],
      "disagreement": false
    }
  ],
  "unverifiableFindings": [],
  "coverage": {
    "includedPaths": [
      "pkg/credentialprovider/config.go"
    ],
    "excludedPaths": [
      "pkg/credentialprovider/config_test.go"
    ],
    "skippedChecks": [
      "excluded content was omitted from reviewer input.",
      "Sandbox verification was not requested."
    ]
  },
  "limitations": [
    "code-quality: CLI token usage is unavailable before invocation; a large fixed protocol reserve is used.",
    "code-quality: Model identity is the configured CLI selection; exact served model identity is unverified.",
    "code-quality: Context capacity and protocol reserve are caller-configured assumptions.",
    "model usage reporting is unavailable",
    "security: CLI token usage is unavailable before invocation; a large fixed protocol reserve is used.",
    "security: Model identity is the configured CLI selection; exact served model identity is unverified.",
    "security: Context capacity and protocol reserve are caller-configured assumptions.",
    "performance: CLI token usage is unavailable before invocation; a large fixed protocol reserve is used.",
    "performance: Model identity is the configured CLI selection; exact served model identity is unverified.",
    "performance: Context capacity and protocol reserve are caller-configured assumptions."
  ],
  "preflight": {
    "contractVersion": "1.0",
    "kind": "preflight",
    "status": "ready",
    "reviewId": "review-915697b72042830362b2",
    "snapshotSha256": "915697b72042830362b23a1b14603c19184924773d4c001dc3c1eb4a0e87706a",
    "policyVersion": "79ce4e88da6498e87a300dc1b13a8f691b5fbdbca3e2e7a16f0858001512ae55",
    "mode": "full",
    "promptVersions": [
      {
        "role": "code-quality",
        "version": "27bce1d1c541c20c1d428ac3a4bd26b0431030779fb71aa43fa5e08a6f32106a"
      },
      {
        "role": "security",
        "version": "b0a7cbe7d719df231500d09537618cd4b0ca1bfd3ef6ee4601ee4c70ecb4ad14"
      },
      {
        "role": "performance",
        "version": "420a63cca0f8281775e8c0d000ed60a2048656da3f6eefe49bf3a80ca8e154a2"
      }
    ],
    "scopeCounts": {
      "included": 1,
      "excluded": 1,
      "binary": 0,
      "generated": 0,
      "oversized": 0
    },
    "budgets": {
      "maxFiles": 50,
      "maxChangedLines": 6000,
      "maxLinesPerFile": 2000,
      "maxBytesPerFile": 1048576,
      "maxInputTokensPerReviewer": 100000,
      "maxOutputTokensPerReviewer": 2000,
      "maxModelCalls": 3,
      "timeoutSeconds": 120
    },
    "harness": {
      "adapterId": "static-review-harness",
      "adapterVersion": "1.0",
      "controls": {
        "readOnlyInput": "enforced",
        "noAgentWrite": "enforced",
        "noAgentExecution": "enforced",
        "noAgentNetwork": "enforced",
        "freshContextPerReviewer": "enforced",
        "crossSessionMemoryDisabled": "enforced"
      }
    },
    "reviewers": [
      {
        "role": "code-quality",
        "adapterId": "claude-code-v1",
        "providerId": "anthropic-claude-code",
        "modelId": "sonnet",
        "dataHandling": "hosted",
        "adapterVersion": "1.0",
        "inputTokenUpperBound": 84299,
        "controls": {
          "freshContextPerReviewer": "enforced",
          "crossSessionMemoryDisabled": "enforced",
          "structuredOutput": "enforced",
          "usageReporting": "unsupported"
        }
      },
      {
        "role": "security",
        "adapterId": "claude-code-v1",
        "providerId": "anthropic-claude-code",
        "modelId": "sonnet",
        "dataHandling": "hosted",
        "adapterVersion": "1.0",
        "inputTokenUpperBound": 85481,
        "controls": {
          "freshContextPerReviewer": "enforced",
          "crossSessionMemoryDisabled": "enforced",
          "structuredOutput": "enforced",
          "usageReporting": "unsupported"
        }
      },
      {
        "role": "performance",
        "adapterId": "claude-code-v1",
        "providerId": "anthropic-claude-code",
        "modelId": "sonnet",
        "dataHandling": "hosted",
        "adapterVersion": "1.0",
        "inputTokenUpperBound": 84944,
        "controls": {
          "freshContextPerReviewer": "enforced",
          "crossSessionMemoryDisabled": "enforced",
          "structuredOutput": "enforced",
          "usageReporting": "unsupported"
        }
      }
    ],
    "hostedSourceDisclosure": true,
    "limitations": [
      "code-quality: CLI token usage is unavailable before invocation; a large fixed protocol reserve is used.",
      "code-quality: Model identity is the configured CLI selection; exact served model identity is unverified.",
      "code-quality: Context capacity and protocol reserve are caller-configured assumptions.",
      "model usage reporting is unavailable",
      "security: CLI token usage is unavailable before invocation; a large fixed protocol reserve is used.",
      "security: Model identity is the configured CLI selection; exact served model identity is unverified.",
      "security: Context capacity and protocol reserve are caller-configured assumptions.",
      "performance: CLI token usage is unavailable before invocation; a large fixed protocol reserve is used.",
      "performance: Model identity is the configured CLI selection; exact served model identity is unverified.",
      "performance: Context capacity and protocol reserve are caller-configured assumptions."
    ],
    "sandbox": {
      "status": "not-requested"
    },
    "audit": {
      "enabled": false,
      "metadataOnly": true,
      "retentionDays": 0
    }
  },
  "sandbox": {
    "status": "not-requested"
  }
}
