{
  "contractVersion": "1.0",
  "reviewId": "review-558b292486c453d458ec",
  "snapshotSha256": "558b292486c453d458ecd40dadbf8676299243aa4f324a2b3072112bb445f704",
  "mode": "full",
  "status": "complete",
  "verdict": "request-changes",
  "reviewers": [
    {
      "role": "code-quality",
      "status": "completed",
      "adapter": {
        "adapterId": "claude-code-v1",
        "providerId": "anthropic-claude-code",
        "modelId": "sonnet"
      },
      "invocationId": "invocation-058238ca-6054-459a-9828-0a430d03db17",
      "contextId": "1d70d484-e1a5-4349-8b98-3c02fa9fcf72"
    },
    {
      "role": "security",
      "status": "completed",
      "adapter": {
        "adapterId": "claude-code-v1",
        "providerId": "anthropic-claude-code",
        "modelId": "sonnet"
      },
      "invocationId": "invocation-c9e3547a-f5f6-4ff4-8183-633188a967e0",
      "contextId": "5ebc076f-e461-471c-bbc7-1b26855f898f"
    },
    {
      "role": "performance",
      "status": "completed",
      "adapter": {
        "adapterId": "claude-code-v1",
        "providerId": "anthropic-claude-code",
        "modelId": "sonnet"
      },
      "invocationId": "invocation-81923bec-109a-467f-8b09-2ddadf759c4b",
      "contextId": "9e2a8fd0-48a3-4105-b2ab-b3d98f523ed8"
    }
  ],
  "findings": [
    {
      "id": "finding-1",
      "category": "security",
      "severity": "Required",
      "title": "Attacker-controlled flag name crashes parser via inherited property on aliases object",
      "impact": "`aliases` is a plain `{}`. For a flag such as `--constructor x`, `--__proto__ x`, `--toString x` or `--valueOf x`, `aliases[key]` resolves to an inherited, truthy Object.prototype member. The new `aliasIsBoolean` then calls `.some` on it. That member is not an array, so this throws a TypeError. Any program that parses untrusted argv can be made to crash, which is a denial of service. Before this change such input did not throw at this point.",
      "evidence": {
        "path": "index.js",
        "startLine": 88,
        "endLine": 92
      },
      "recommendation": "Create `aliases` with `Object.create(null)`, or guard with `Object.prototype.hasOwnProperty.call(aliases, key)`. Apply the same guard in `argDefined` and in the new condition at line 119. Also check `Array.isArray` inside `aliasIsBoolean`.",
      "sourceFindings": [
        {
          "reviewer": "security",
          "findingId": "F-1",
          "severity": "Required",
          "confidence": 0.8
        }
      ],
      "disagreement": false
    }
  ],
  "unverifiableFindings": [],
  "coverage": {
    "includedPaths": [
      "index.js"
    ],
    "excludedPaths": [],
    "skippedChecks": [
      "Sandbox verification was not requested."
    ]
  },
  "limitations": [
    "code-quality: CLI token usage is unavailable before invocation; a large fixed protocol reserve is used.",
    "code-quality: Model identity is the configured CLI selection; exact served model identity is unverified.",
    "code-quality: Context capacity and protocol reserve are caller-configured assumptions.",
    "model usage reporting is unavailable",
    "security: CLI token usage is unavailable before invocation; a large fixed protocol reserve is used.",
    "security: Model identity is the configured CLI selection; exact served model identity is unverified.",
    "security: Context capacity and protocol reserve are caller-configured assumptions.",
    "performance: CLI token usage is unavailable before invocation; a large fixed protocol reserve is used.",
    "performance: Model identity is the configured CLI selection; exact served model identity is unverified.",
    "performance: Context capacity and protocol reserve are caller-configured assumptions."
  ],
  "preflight": {
    "contractVersion": "1.0",
    "kind": "preflight",
    "status": "ready",
    "reviewId": "review-558b292486c453d458ec",
    "snapshotSha256": "558b292486c453d458ecd40dadbf8676299243aa4f324a2b3072112bb445f704",
    "policyVersion": "8b36be5d1e2bcb592b6d09c0d4913515235c20ca7ef01f4a18c32c7e8659c7c1",
    "mode": "full",
    "promptVersions": [
      {
        "role": "code-quality",
        "version": "27bce1d1c541c20c1d428ac3a4bd26b0431030779fb71aa43fa5e08a6f32106a"
      },
      {
        "role": "security",
        "version": "b0a7cbe7d719df231500d09537618cd4b0ca1bfd3ef6ee4601ee4c70ecb4ad14"
      },
      {
        "role": "performance",
        "version": "420a63cca0f8281775e8c0d000ed60a2048656da3f6eefe49bf3a80ca8e154a2"
      }
    ],
    "scopeCounts": {
      "included": 1,
      "excluded": 0,
      "binary": 0,
      "generated": 0,
      "oversized": 0
    },
    "budgets": {
      "maxFiles": 50,
      "maxChangedLines": 6000,
      "maxLinesPerFile": 2000,
      "maxBytesPerFile": 1048576,
      "maxInputTokensPerReviewer": 100000,
      "maxOutputTokensPerReviewer": 2000,
      "maxModelCalls": 3,
      "timeoutSeconds": 120
    },
    "harness": {
      "adapterId": "static-review-harness",
      "adapterVersion": "1.0",
      "controls": {
        "readOnlyInput": "enforced",
        "noAgentWrite": "enforced",
        "noAgentExecution": "enforced",
        "noAgentNetwork": "enforced",
        "freshContextPerReviewer": "enforced",
        "crossSessionMemoryDisabled": "enforced"
      }
    },
    "reviewers": [
      {
        "role": "code-quality",
        "adapterId": "claude-code-v1",
        "providerId": "anthropic-claude-code",
        "modelId": "sonnet",
        "dataHandling": "hosted",
        "adapterVersion": "1.0",
        "inputTokenUpperBound": 80734,
        "controls": {
          "freshContextPerReviewer": "enforced",
          "crossSessionMemoryDisabled": "enforced",
          "structuredOutput": "enforced",
          "usageReporting": "unsupported"
        }
      },
      {
        "role": "security",
        "adapterId": "claude-code-v1",
        "providerId": "anthropic-claude-code",
        "modelId": "sonnet",
        "dataHandling": "hosted",
        "adapterVersion": "1.0",
        "inputTokenUpperBound": 81916,
        "controls": {
          "freshContextPerReviewer": "enforced",
          "crossSessionMemoryDisabled": "enforced",
          "structuredOutput": "enforced",
          "usageReporting": "unsupported"
        }
      },
      {
        "role": "performance",
        "adapterId": "claude-code-v1",
        "providerId": "anthropic-claude-code",
        "modelId": "sonnet",
        "dataHandling": "hosted",
        "adapterVersion": "1.0",
        "inputTokenUpperBound": 81379,
        "controls": {
          "freshContextPerReviewer": "enforced",
          "crossSessionMemoryDisabled": "enforced",
          "structuredOutput": "enforced",
          "usageReporting": "unsupported"
        }
      }
    ],
    "hostedSourceDisclosure": true,
    "limitations": [
      "code-quality: CLI token usage is unavailable before invocation; a large fixed protocol reserve is used.",
      "code-quality: Model identity is the configured CLI selection; exact served model identity is unverified.",
      "code-quality: Context capacity and protocol reserve are caller-configured assumptions.",
      "model usage reporting is unavailable",
      "security: CLI token usage is unavailable before invocation; a large fixed protocol reserve is used.",
      "security: Model identity is the configured CLI selection; exact served model identity is unverified.",
      "security: Context capacity and protocol reserve are caller-configured assumptions.",
      "performance: CLI token usage is unavailable before invocation; a large fixed protocol reserve is used.",
      "performance: Model identity is the configured CLI selection; exact served model identity is unverified.",
      "performance: Context capacity and protocol reserve are caller-configured assumptions."
    ],
    "sandbox": {
      "status": "not-requested"
    },
    "audit": {
      "enabled": false,
      "metadataOnly": true,
      "retentionDays": 0
    }
  },
  "sandbox": {
    "status": "not-requested"
  }
}
